,,,,,,,
Response ID,PSSN,Name,Time,Date,Description,Target,Status
,,,,,,,
M 114,9564,Elie Aboud,21:10,2019-08-14,The criminal was arrested,6927,The killer is under arrest
Z 712,4172,Mamdouh Araji ,12:06,2019-02-13,"The police came right away and After searching and checking, the criminal was found",5825,The killer is under arrest
R 423,8745,Hassan Hawa,2:47,2020-12-20,The police came right away and took the necessary measures,7345,The case is being investigated and scrutinized
B 793,7405,Ahmad Abu Shahla,16:21,2020-06-30,The police came and started the investigation ,3576,Nothing concrete yet
A 194,7376,Hadi Juneid,5:19,2021-06-06,"After searching and checking, the criminal was found",9834,The killer is under arrest
B 683,2374,Rana Yazbik,18:48,2021-09-19,The killer turned himself in after confronting the police for half an hour,4982,The killer is under arrest